{
  "schema_id": "urn:ieim:schema:attachment-artifact:1.0.0",
  "schema_version": "1.0.0",
  "attachment_id": "0c3eae85-c322-509b-879d-4bd24fc178b2",
  "message_id": "b81451c0-5745-5dba-9d44-6b7e245335ff",
  "filename": "rechnung.txt",
  "mime_type": "text/plain",
  "size_bytes": 51,
  "sha256": "sha256:e5d926f82f6e6b858a2b078e33a7dd23983e38f5017fcd7e6787ae2fc585198f",
  "av_status": "INFECTED",
  "extracted_text_uri": "data/samples/attachments/0c3eae85-c322-509b-879d-4bd24fc178b2.txt",
  "extracted_text_sha256": "sha256:e5d926f82f6e6b858a2b078e33a7dd23983e38f5017fcd7e6787ae2fc585198f",
  "ocr_applied": false,
  "ocr_confidence": null,
  "doc_type_candidates": [
    {
      "doc_type_label": "DOC_INVOICE",
      "confidence": 0.9,
      "evidence": [
        {
          "source": "ATTACHMENT_TEXT",
          "start": 9,
          "end": 31,
          "snippet_redacted": "polizzennr: 99-0001112",
          "snippet_sha256": "sha256:191d152a69e26b63cf359ee15a9b51ea1b9f497373df9eb27fea619b6a636577"
        }
      ]
    }
  ],
  "created_at": "2026-01-17T08:00:00Z"
}